{
  "schema_version": 2,
  "task_id": "P2",
  "task_record": ".pi/tasks/backend-neutral-cpn-P2-tools-provenance.md",
  "owners": {
    "writers": [
      {
        "role": "p2-a09-test-and-control-writer",
        "agent": "ksdft2effmass-tests",
        "agent_record": ".pi/agents/ksdft2effmass-tests.md",
        "owned_paths": [
          "python/tests/software_verification/ksdft2effmass/integration/provenance/test__json_fixtures_runtime_agreement_v1.py",
          ".pi/evidence/backend-neutral-cpn-P2-tools-provenance/task-ownership.json",
          ".pi/evidence/backend-neutral-cpn-P2-tools-provenance/p2-a09-test-evidence-ownership.json",
          ".pi/evidence/backend-neutral-cpn-P2-tools-provenance/p2-a09-test-evidence-node-migration.json",
          ".pi/evidence/backend-neutral-cpn-P2-tools-provenance/p2-a09-test-evidence-inventory.json",
          ".pi/evidence/backend-neutral-cpn-P2-tools-provenance/p2-a09-review.md",
          ".pi/evidence/backend-neutral-cpn-P2-tools-provenance/p2-a09-completion.json",
          ".pi/evidence/backend-neutral-cpn-P2-tools-provenance/p2-a09-parent-verification.md",
          ".pi/evidence/backend-neutral-cpn-P2-tools-provenance/provenance-audit-queue.json"
        ]
      }
    ],
    "reviewers": [
      {
        "role": "p2-a09-targeted-read-only-reviewer",
        "agent": "ksdft2effmass-integration-reviewer",
        "agent_record": ".pi/agents/ksdft2effmass-integration-reviewer.md"
      }
    ]
  },
  "completion_validator": {
    "path": ".pi/evidence/backend-neutral-cpn-P2-tools-provenance/validate_p2_completion.py",
    "command": [
      "python",
      ".pi/evidence/backend-neutral-cpn-P2-tools-provenance/validate_p2_completion.py"
    ],
    "required_before_review": true
  }
}
