{
  "schema_version": 2,
  "task_id": "python.architecture-refactor.public-import-boundaries.current-fact-foundation.aggregate-verification",
  "task_record": "tasks/software/python.architecture-refactor.public-import-boundaries.current-fact-foundation.aggregate-verification.json",
  "owners": {
    "writers": [
      {
        "role": "f0-aggregate-verification-coordinator",
        "agent": "ksdft2effmass-harness-implementation",
        "agent_record": ".pi/agents/ksdft2effmass-harness-implementation.md",
        "owned_paths": [
          ".pi/task-ownership/python.architecture-refactor.public-import-boundaries.current-fact-foundation.aggregate-verification.json",
          ".pi/task-ownership/validate_f0_aggregate_verification.sh"
        ]
      }
    ],
    "reviewers": [
      {
        "role": "f0-remediation-architecture-reviewer",
        "agent": "ksdft2effmass-architecture",
        "agent_record": ".pi/agents/ksdft2effmass-architecture.md"
      },
      {
        "role": "f0-remediation-integration-reviewer",
        "agent": "ksdft2effmass-integration-reviewer",
        "agent_record": ".pi/agents/ksdft2effmass-integration-reviewer.md"
      }
    ]
  },
  "completion_validator": {
    "path": ".pi/task-ownership/validate_f0_aggregate_verification.sh",
    "command": [
      ".pi/task-ownership/validate_f0_aggregate_verification.sh"
    ],
    "required_before_review": true
  }
}
